{
  "app_base_url": "https://your-app-url",
  "app_username": null,
  "app_password": null,
  "app_auth_strategy": "env-var",
  "test_output_path": "tests/e2e",
  "report_output_path": "playwright-report",
  "screenshot_mode": "on-failure",
  "log_level": "step",
  "playwright_project_mode": "new",
  "playwright_config_path": null,
  "input_source": "ado",
  "raw_input_file": null,
  "user_story_ado_link": "https://dev.azure.com/everi/Loyalty%20Kiosk/_workitems/edit/1326051",
  "user_story_id": 1326051,
  "test_cases_ado_link": "https://dev.azure.com/everi/Loyalty%20Kiosk/_testPlans/execute?planId=432931&suiteId=1329228",
  "test_plan_id": 432931,
  "test_suite_id": 1329228,
  "reviewer_ado_user_id": "ado-user-id",
  "target_repo": "your-ado-repo-name",
  "target_branch": "main",
  "target_local_path": null,
  "spec_name_override": null,
  "target_pages": [],
  "run_mode": "dry-run",
  "execution_confirmation": null,
  "allow_ado_mutation": false,
  "allow_probe_resources": false,
  "ado_access_mode": "read-only",
  "ado_tool_calls_mode": "read-wrapper-only",
  "ado_write_tools_disabled": true,
  "ado_pat": null,
  "ado_org": "everi",
  "ado_project": "Loyalty Kiosk",
  "api_layer": {
    "enabled": false,
    "api_source": "openapi",
    "api_base_url": "https://your-api-url",
    "api_auth_strategy": "bearer-env",
    "openapi_spec_path": "./api-specs/loyalty-kiosk.openapi.yaml",
    "postman_collection_path": null,
    "postman_environment_path": null,
    "curl_source_file": null,
    "curl_commands": [],
    "manual_endpoints": [],
    "domains": [],
    "schema_validation": "warn",
    "emit_hybrid_spec_stubs": false
  },
  "self_healing": {
    "enabled": false,
    "heal_task": "heal-failures",
    "app_version": null,
    "previous_app_version": null,
    "heal_mode": "report-driven",
    "results_report_path": "test-results/results.json",
    "max_attempts_per_locator": 3,
    "max_total_reruns": 5,
    "heal_shared_locators": true,
    "strategy": "semantic-first"
  }
}
